{
  "ddl_version": "0.1.0",
  "drawing": {
    "id": "10000000-0000-4000-8000-000000000012",
    "title": "balcony threshold",
    "discipline": "architecture",
    "type": "detail",
    "detail_type": "balcony_threshold",
    "mode": "draft",
    "scale": 10,
    "units": "mm",
    "jurisdiction": "GB-ENG",
    "rev": "A",
    "hash": "sha256:966686cde0dd265c345b5fe0009a9385d86b663e0fbca6a12e60e5eddf622c24",
    "parent_hash": null,
    "profile_stack": [
      {
        "id": "gb-eng-residential",
        "name": "GB-ENG Residential",
        "version": "0.1.0",
        "layer": "jurisdiction",
        "tier": 1,
        "signer": null
      },
      {
        "id": "generic",
        "name": "Generic",
        "version": "0.1.0",
        "layer": "generic",
        "tier": null,
        "signer": null
      }
    ],
    "card_id": "card-balcony_threshold",
    "created_at": "2026-09-27T00:00:00Z"
  },
  "materials": [
    {
      "id": "mat_slab",
      "name": "slab",
      "category": "test_material",
      "basis": "description_only",
      "source": "user",
      "confidence": 1,
      "verify": false
    },
    {
      "id": "mat_insulation",
      "name": "insulation",
      "category": "test_material",
      "basis": "description_only",
      "source": "user",
      "confidence": 1,
      "verify": false
    },
    {
      "id": "mat_threshold",
      "name": "threshold",
      "category": "test_material",
      "basis": "description_only",
      "source": "user",
      "confidence": 1,
      "verify": false
    },
    {
      "id": "mat_drainage_channel",
      "name": "drainage channel",
      "category": "test_material",
      "basis": "description_only",
      "source": "user",
      "confidence": 1,
      "verify": false
    }
  ],
  "objects": [
    {
      "id": "slab",
      "class": "slab",
      "label": "slab",
      "material_id": "mat_slab",
      "thickness": 150,
      "height": 150,
      "level": null,
      "base_offset": null,
      "geometry": {
        "kind": "rect",
        "origin": [
          0,
          0
        ],
        "width": 800,
        "height": 150
      },
      "source": "user",
      "confidence": 1,
      "verify": false,
      "rule_refs": [
        "generic-balcony_threshold-geometry",
        "gb-eng-residential-balcony_threshold-continuity"
      ],
      "layer_id": "detail"
    },
    {
      "id": "insulation",
      "class": "insulation",
      "label": "insulation",
      "material_id": "mat_insulation",
      "thickness": 100,
      "height": 100,
      "level": null,
      "base_offset": null,
      "geometry": {
        "kind": "rect",
        "origin": [
          0,
          150
        ],
        "width": 800,
        "height": 100
      },
      "source": "user",
      "confidence": 1,
      "verify": false,
      "rule_refs": [],
      "layer_id": "detail"
    },
    {
      "id": "threshold",
      "class": "threshold",
      "label": "threshold",
      "material_id": "mat_threshold",
      "thickness": 25,
      "height": 25,
      "level": null,
      "base_offset": null,
      "geometry": {
        "kind": "rect",
        "origin": [
          500,
          250
        ],
        "width": 150,
        "height": 25
      },
      "source": "user",
      "confidence": 1,
      "verify": false,
      "rule_refs": [],
      "layer_id": "detail"
    },
    {
      "id": "drain",
      "class": "drainage_channel",
      "label": "drain",
      "material_id": "mat_drainage_channel",
      "thickness": 80,
      "height": 80,
      "level": null,
      "base_offset": null,
      "geometry": {
        "kind": "rect",
        "origin": [
          650,
          150
        ],
        "width": 80,
        "height": 80
      },
      "source": "user",
      "confidence": 1,
      "verify": false,
      "rule_refs": [],
      "layer_id": "detail"
    }
  ],
  "connections": [
    {
      "id": "connection-1",
      "kind": "abuts",
      "from": "insulation",
      "to": "slab",
      "source": "user",
      "confidence": 1,
      "verify": false
    }
  ],
  "constraints": [
    {
      "id": "sum-thickness",
      "type": "sum",
      "of": [
        "slab.thickness",
        "insulation.thickness",
        "threshold.thickness",
        "drain.thickness"
      ],
      "equals": "assembly_total",
      "source": "user",
      "confidence": 1,
      "verify": false
    }
  ],
  "dimensions": [
    {
      "id": "assembly_total",
      "kind": "linear",
      "refs": [
        "slab",
        "insulation",
        "threshold",
        "drain"
      ],
      "value": 355,
      "driving": false,
      "source": "user",
      "confidence": 1,
      "verify": false
    }
  ],
  "annotations": [
    {
      "id": "note-supplied",
      "kind": "note",
      "text": "All dimensions are synthetic user-supplied test inputs, not design recommendations.",
      "source": "user",
      "confidence": 1,
      "verify": false
    }
  ],
  "layers": [
    {
      "id": "detail",
      "name": "Detail",
      "line_weight_mm": 0.35
    }
  ],
  "schedules": [],
  "solver": {
    "status": "resolved",
    "conflicts": []
  },
  "checks": null,
  "stamp": null
}
