{
  "ddl_version": "0.1.0",
  "drawing": {
    "id": "10000000-0000-4000-8000-000000000003",
    "title": "window sill",
    "discipline": "architecture",
    "type": "detail",
    "detail_type": "window_sill",
    "mode": "draft",
    "scale": 10,
    "units": "mm",
    "jurisdiction": "GB-ENG",
    "rev": "A",
    "hash": "sha256:bb9861cf0a00f76478025296f80e9ddd66a2016a5dcc959bf7a769f6c86bc6a9",
    "parent_hash": null,
    "profile_stack": [
      {
        "id": "gb-eng-residential",
        "name": "GB-ENG Residential",
        "version": "0.1.0",
        "layer": "jurisdiction",
        "tier": 1,
        "signer": null
      },
      {
        "id": "generic",
        "name": "Generic",
        "version": "0.1.0",
        "layer": "generic",
        "tier": null,
        "signer": null
      }
    ],
    "card_id": "card-window_sill",
    "created_at": "2026-09-27T00:00:00Z"
  },
  "materials": [
    {
      "id": "mat_masonry",
      "name": "masonry",
      "category": "test_material",
      "basis": "description_only",
      "source": "user",
      "confidence": 1,
      "verify": false
    },
    {
      "id": "mat_sill",
      "name": "sill",
      "category": "test_material",
      "basis": "description_only",
      "source": "user",
      "confidence": 1,
      "verify": false
    },
    {
      "id": "mat_membrane",
      "name": "membrane",
      "category": "test_material",
      "basis": "description_only",
      "source": "user",
      "confidence": 1,
      "verify": false
    },
    {
      "id": "mat_window_frame",
      "name": "window frame",
      "category": "test_material",
      "basis": "description_only",
      "source": "user",
      "confidence": 1,
      "verify": false
    }
  ],
  "objects": [
    {
      "id": "wall",
      "class": "masonry",
      "label": "wall",
      "material_id": "mat_masonry",
      "thickness": 102.5,
      "height": 400,
      "level": null,
      "base_offset": null,
      "geometry": {
        "kind": "rect",
        "origin": [
          0,
          0
        ],
        "width": 200,
        "height": 400
      },
      "source": "user",
      "confidence": 1,
      "verify": false,
      "rule_refs": [
        "generic-window_sill-geometry",
        "gb-eng-residential-window_sill-continuity"
      ],
      "layer_id": "detail"
    },
    {
      "id": "sill",
      "class": "sill",
      "label": "sill",
      "material_id": "mat_sill",
      "thickness": 50,
      "height": 50,
      "level": null,
      "base_offset": null,
      "geometry": {
        "kind": "rect",
        "origin": [
          -50,
          400
        ],
        "width": 350,
        "height": 50
      },
      "source": "user",
      "confidence": 1,
      "verify": false,
      "rule_refs": [],
      "layer_id": "detail"
    },
    {
      "id": "tray",
      "class": "membrane",
      "label": "tray",
      "material_id": "mat_membrane",
      "thickness": 2,
      "height": 2,
      "level": null,
      "base_offset": null,
      "geometry": {
        "kind": "rect",
        "origin": [
          0,
          450
        ],
        "width": 250,
        "height": 2
      },
      "source": "user",
      "confidence": 1,
      "verify": false,
      "rule_refs": [],
      "layer_id": "detail"
    },
    {
      "id": "frame",
      "class": "window_frame",
      "label": "frame",
      "material_id": "mat_window_frame",
      "thickness": 70,
      "height": 300,
      "level": null,
      "base_offset": null,
      "geometry": {
        "kind": "rect",
        "origin": [
          100,
          452
        ],
        "width": 70,
        "height": 300
      },
      "source": "user",
      "confidence": 1,
      "verify": false,
      "rule_refs": [],
      "layer_id": "detail"
    }
  ],
  "connections": [
    {
      "id": "connection-1",
      "kind": "abuts",
      "from": "sill",
      "to": "wall",
      "source": "user",
      "confidence": 1,
      "verify": false
    }
  ],
  "constraints": [
    {
      "id": "sum-thickness",
      "type": "sum",
      "of": [
        "wall.thickness",
        "sill.thickness",
        "tray.thickness",
        "frame.thickness"
      ],
      "equals": "assembly_total",
      "source": "user",
      "confidence": 1,
      "verify": false
    }
  ],
  "dimensions": [
    {
      "id": "assembly_total",
      "kind": "linear",
      "refs": [
        "wall",
        "sill",
        "tray",
        "frame"
      ],
      "value": null,
      "driving": false,
      "source": "user",
      "confidence": 1,
      "verify": false
    }
  ],
  "annotations": [
    {
      "id": "note-supplied",
      "kind": "note",
      "text": "All dimensions are synthetic user-supplied test inputs, not design recommendations.",
      "source": "user",
      "confidence": 1,
      "verify": false
    }
  ],
  "layers": [
    {
      "id": "detail",
      "name": "Detail",
      "line_weight_mm": 0.35
    }
  ],
  "schedules": [],
  "solver": {
    "status": "unresolved",
    "conflicts": []
  },
  "checks": null,
  "stamp": null
}
