{
  "ddl_version": "0.1.0",
  "drawing": {
    "id": "b3e0ba97-5e74-5220-b78b-4efab69c3ea1",
    "title": "Window jamb, plan",
    "discipline": "architecture",
    "type": "detail",
    "detail_type": "window_jamb",
    "mode": "draft",
    "scale": 10,
    "units": "mm",
    "jurisdiction": "GB-ENG",
    "rev": "A",
    "hash": "sha256:f7ccb1c9892951ffba883254b63d9695b457b049ed9e37a4462a7690cf473e1f",
    "parent_hash": null,
    "profile_stack": [
      {
        "id": "gb-eng-residential",
        "name": "GB-ENG Residential",
        "version": "0.1.0",
        "layer": "jurisdiction",
        "tier": 1,
        "signer": null
      },
      {
        "id": "generic",
        "name": "Generic",
        "version": "0.1.0",
        "layer": "generic",
        "tier": null,
        "signer": null
      }
    ],
    "card_id": "card-render-fixture-window_jamb",
    "created_at": "2026-09-27T09:00:00Z"
  },
  "materials": [
    {
      "id": "block_dense",
      "name": "Dense concrete block",
      "category": "masonry",
      "basis": "description_only",
      "source": "user",
      "confidence": 1,
      "verify": false
    },
    {
      "id": "brick_facing",
      "name": "Facing brick",
      "category": "masonry",
      "basis": "description_only",
      "source": "user",
      "confidence": 1,
      "verify": false
    },
    {
      "id": "closer_ins",
      "name": "Insulated cavity closer",
      "category": "insulation",
      "basis": "description_only",
      "source": "user",
      "confidence": 1,
      "verify": false
    },
    {
      "id": "glazing_dg",
      "name": "Double glazed unit",
      "category": "glazing",
      "basis": "description_only",
      "source": "user",
      "confidence": 1,
      "verify": false
    },
    {
      "id": "pir_board",
      "name": "PIR insulation board",
      "category": "insulation",
      "basis": "description_only",
      "source": "user",
      "confidence": 1,
      "verify": false
    },
    {
      "id": "plaster",
      "name": "Plasterboard and skim",
      "category": "finish",
      "basis": "description_only",
      "source": "user",
      "confidence": 1,
      "verify": false
    },
    {
      "id": "upvc_frame",
      "name": "uPVC window frame",
      "category": "frame",
      "basis": "description_only",
      "source": "user",
      "confidence": 1,
      "verify": false
    }
  ],
  "objects": [
    {
      "id": "brick",
      "class": "masonry",
      "label": "Outer leaf",
      "material_id": "brick_facing",
      "thickness": null,
      "height": null,
      "level": null,
      "base_offset": null,
      "geometry": {
        "kind": "polygon",
        "points": [
          [
            300,
            0
          ],
          [
            900,
            0
          ],
          [
            900,
            102.5
          ],
          [
            300,
            102.5
          ]
        ],
        "closed": true
      },
      "source": "user",
      "confidence": 1.0,
      "verify": false,
      "rule_refs": [],
      "layer_id": "walls"
    },
    {
      "id": "cavity",
      "class": "cavity",
      "label": "Residual cavity",
      "material_id": null,
      "thickness": null,
      "height": null,
      "level": null,
      "base_offset": null,
      "geometry": {
        "kind": "polygon",
        "points": [
          [
            300,
            102.5
          ],
          [
            900,
            102.5
          ],
          [
            900,
            152.5
          ],
          [
            300,
            152.5
          ]
        ],
        "closed": true
      },
      "source": "user",
      "confidence": 1.0,
      "verify": false,
      "rule_refs": [],
      "layer_id": "walls"
    },
    {
      "id": "ins",
      "class": "insulation",
      "label": "Cavity insulation",
      "material_id": "pir_board",
      "thickness": null,
      "height": null,
      "level": null,
      "base_offset": null,
      "geometry": {
        "kind": "polygon",
        "points": [
          [
            300,
            152.5
          ],
          [
            900,
            152.5
          ],
          [
            900,
            252.5
          ],
          [
            300,
            252.5
          ]
        ],
        "closed": true
      },
      "source": "profile",
      "confidence": 1.0,
      "verify": false,
      "source_detail": {
        "profile": {
          "id": "gb-eng-residential",
          "version": "0.1.0"
        }
      },
      "rule_refs": [],
      "layer_id": "walls"
    },
    {
      "id": "block",
      "class": "masonry",
      "label": "Inner leaf",
      "material_id": "block_dense",
      "thickness": null,
      "height": null,
      "level": null,
      "base_offset": null,
      "geometry": {
        "kind": "polygon",
        "points": [
          [
            300,
            252.5
          ],
          [
            900,
            252.5
          ],
          [
            900,
            352.5
          ],
          [
            300,
            352.5
          ]
        ],
        "closed": true
      },
      "source": "user",
      "confidence": 1.0,
      "verify": false,
      "rule_refs": [],
      "layer_id": "walls"
    },
    {
      "id": "plaster",
      "class": "finish",
      "label": "Internal finish",
      "material_id": "plaster",
      "thickness": null,
      "height": null,
      "level": null,
      "base_offset": null,
      "geometry": {
        "kind": "polygon",
        "points": [
          [
            300,
            352.5
          ],
          [
            900,
            352.5
          ],
          [
            900,
            365
          ],
          [
            300,
            365
          ]
        ],
        "closed": true
      },
      "source": "profile",
      "confidence": 1.0,
      "verify": false,
      "source_detail": {
        "profile": {
          "id": "gb-eng-residential",
          "version": "0.1.0"
        }
      },
      "rule_refs": [],
      "layer_id": "walls"
    },
    {
      "id": "closer",
      "class": "cavity_closer",
      "label": "Insulated cavity closer",
      "material_id": "closer_ins",
      "thickness": null,
      "height": null,
      "level": null,
      "base_offset": null,
      "geometry": {
        "kind": "polygon",
        "points": [
          [
            260,
            102.5
          ],
          [
            300,
            102.5
          ],
          [
            300,
            252.5
          ],
          [
            260,
            252.5
          ]
        ],
        "closed": true
      },
      "source": "user",
      "confidence": 1.0,
      "verify": false,
      "rule_refs": [],
      "layer_id": "walls"
    },
    {
      "id": "frame",
      "class": "window_frame",
      "label": "Window frame jamb",
      "material_id": "upvc_frame",
      "thickness": null,
      "height": null,
      "level": null,
      "base_offset": null,
      "geometry": {
        "kind": "polygon",
        "points": [
          [
            140,
            40
          ],
          [
            260,
            40
          ],
          [
            260,
            110
          ],
          [
            140,
            110
          ]
        ],
        "closed": true
      },
      "source": "ai_inferred",
      "confidence": 0.7,
      "verify": true,
      "source_detail": {
        "model": {
          "provider": "anthropic",
          "model_id": "claude-opus-5-5",
          "task": "interpret"
        },
        "note": "Position read from the reference; confirm on site."
      },
      "rule_refs": [],
      "layer_id": "openings"
    },
    {
      "id": "glass",
      "class": "glazing",
      "label": "Glazing",
      "material_id": "glazing_dg",
      "thickness": null,
      "height": null,
      "level": null,
      "base_offset": null,
      "geometry": {
        "kind": "polygon",
        "points": [
          [
            0,
            60
          ],
          [
            140,
            60
          ],
          [
            140,
            90
          ],
          [
            0,
            90
          ]
        ],
        "closed": true
      },
      "source": "user",
      "confidence": 1.0,
      "verify": false,
      "rule_refs": [],
      "layer_id": "openings"
    }
  ],
  "connections": [],
  "constraints": [],
  "dimensions": [
    {
      "id": "wall_total",
      "kind": "linear",
      "refs": [
        "brick",
        "plaster"
      ],
      "value": 365,
      "driving": true,
      "source": "user",
      "confidence": 1.0,
      "verify": false,
      "display": true
    },
    {
      "id": "closer_width",
      "kind": "linear",
      "refs": [
        "closer",
        "brick"
      ],
      "value": 40,
      "driving": true,
      "source": "user",
      "confidence": 1.0,
      "verify": false,
      "display": true
    }
  ],
  "annotations": [
    {
      "id": "an_closer",
      "kind": "leader",
      "text": "Insulated cavity closer",
      "targets": [
        "closer"
      ],
      "position": [
        -120.0,
        327.5
      ],
      "layer_id": "anno",
      "source": "user",
      "confidence": 1
    },
    {
      "id": "an_frame",
      "kind": "leader",
      "text": "Frame overlaps closer (to be confirmed)",
      "targets": [
        "frame"
      ],
      "position": [
        -200.0,
        225.0
      ],
      "layer_id": "anno",
      "source": "user",
      "confidence": 1
    }
  ],
  "layers": [
    {
      "id": "walls",
      "name": "A-Walls"
    },
    {
      "id": "openings",
      "name": "A-Openings"
    },
    {
      "id": "anno",
      "name": "A-Anno"
    }
  ],
  "schedules": [],
  "solver": {
    "status": "resolved",
    "conflicts": [],
    "resolved_at": "2026-09-27T09:00:01Z"
  },
  "checks": null,
  "stamp": null
}
